id,question,answer,created_at,updated_at
0170b002-7e6a-2cb7-91aa-dea70f4aacfe,How do I save a favorite location?,"You can save a location as favorite by selecting it on the map and choosing ""Add to Favorites"" from the options menu.",2025-04-30 17:30:51.887+00,2025-04-30 17:30:51.887+00
60100c22-7143-036a-9dd5-95531f0ea242,How do I use the QR code scanner?,"To use the QR code scanner, go to the Scan screen and point your camera at the QR code on your parcel. The app will automatically recognize and process the code.",2025-04-30 17:30:51.887+00,2025-04-30 17:30:51.887+00
9e6a7e65-8466-6d01-ca89-6652cf336bdd,What should I do if my parcel is delayed?,"If your parcel is delayed, you can contact our support team through the Support screen. We will investigate the issue and provide you with updates.",2025-04-30 17:30:51.887+00,2025-04-30 17:30:51.887+00
c70bdfdd-dea3-5893-a43f-83987bd06f04,How do I track my parcel?,You can track your parcel in real-time using the Tracking Map feature. Simply go to the Tracking Map screen and select your parcel to see its current location and estimated delivery time.,2025-04-30 17:30:51.887+00,2025-04-30 17:30:51.887+00
c7adfcf5-884b-b907-be91-67899918ed9c,What payment methods are accepted?,"We accept various payment methods including YenePay, Chapa Payment, TeleBirr, in-app wallet, and cash on delivery.",2025-04-30 17:30:51.887+00,2025-04-30 17:30:51.887+00